{
  "run_id": "run-llm-demo-a-001",
  "kind": "llm",
  "simulated": true,
  "model": "claude-sonnet-5",
  "prompt_hash": "e8a6e14f49e35e96",
  "annotator_id": null,
  "codebook_version": "2.2.0",
  "domain": "math",
  "created_at": "2026-09-19T03:08:58.950Z",
  "usage": {
    "calls": 5,
    "totals": {
      "input_tokens": 1685,
      "output_tokens": 17858,
      "cache_creation_input_tokens": 24341,
      "cache_read_input_tokens": 11403
    },
    "per_call": [
      {
        "input_tokens": 324,
        "output_tokens": 2125,
        "cache_creation_input_tokens": 5602,
        "cache_read_input_tokens": 0,
        "purpose": "segment",
        "session_id": "demo-a-s01"
      },
      {
        "input_tokens": 324,
        "output_tokens": 4352,
        "cache_creation_input_tokens": 2507,
        "cache_read_input_tokens": 3801,
        "purpose": "segment",
        "session_id": "demo-a-s02"
      },
      {
        "input_tokens": 324,
        "output_tokens": 4952,
        "cache_creation_input_tokens": 1478,
        "cache_read_input_tokens": 3801,
        "purpose": "segment",
        "session_id": "demo-a-s03"
      },
      {
        "input_tokens": 324,
        "output_tokens": 5122,
        "cache_creation_input_tokens": 3285,
        "cache_read_input_tokens": 3801,
        "purpose": "segment",
        "session_id": "demo-a-s04"
      },
      {
        "input_tokens": 389,
        "output_tokens": 1307,
        "cache_creation_input_tokens": 11469,
        "cache_read_input_tokens": 0,
        "purpose": "summarise"
      }
    ]
  },
  "episodes": [
    {
      "_id": "0",
      "episode_id": "ep-run-llm-demo-a-001-demo-a-s01-001",
      "run_id": "run-llm-demo-a-001",
      "identifiedBy": "AI",
      "layer_id": "episodes",
      "codebook_version": "2.2.0",
      "domain": "math",
      "EPISODE": "reading",
      "start_turn_id": "demo-a-s01-t001",
      "end_turn_id": "demo-a-s01-t004",
      "evidence": [
        "demo-a-s01-t001",
        "demo-a-s01-t002",
        "demo-a-s01-t003",
        "demo-a-s01-t004"
      ],
      "reviewer_id": null,
      "reviewed_at": null
    },
    {
      "_id": "1",
      "episode_id": "ep-run-llm-demo-a-001-demo-a-s01-002",
      "run_id": "run-llm-demo-a-001",
      "identifiedBy": "AI",
      "layer_id": "episodes",
      "codebook_version": "2.2.0",
      "domain": "math",
      "EPISODE": "analysis",
      "start_turn_id": "demo-a-s01-t005",
      "end_turn_id": "demo-a-s01-t009",
      "evidence": [
        "demo-a-s01-t005",
        "demo-a-s01-t006",
        "demo-a-s01-t007",
        "demo-a-s01-t008",
        "demo-a-s01-t009"
      ],
      "reviewer_id": null,
      "reviewed_at": null
    },
    {
      "_id": "2",
      "episode_id": "ep-run-llm-demo-a-001-demo-a-s01-003",
      "run_id": "run-llm-demo-a-001",
      "identifiedBy": "AI",
      "layer_id": "episodes",
      "codebook_version": "2.2.0",
      "domain": "math",
      "EPISODE": "implementation",
      "start_turn_id": "demo-a-s01-t010",
      "end_turn_id": "demo-a-s01-t012",
      "evidence": [
        "demo-a-s01-t010",
        "demo-a-s01-t011",
        "demo-a-s01-t012"
      ],
      "reviewer_id": null,
      "reviewed_at": null
    },
    {
      "_id": "3",
      "episode_id": "ep-run-llm-demo-a-001-demo-a-s01-004",
      "run_id": "run-llm-demo-a-001",
      "identifiedBy": "AI",
      "layer_id": "episodes",
      "codebook_version": "2.2.0",
      "domain": "math",
      "EPISODE": "reading",
      "start_turn_id": "demo-a-s01-t013",
      "end_turn_id": "demo-a-s01-t016",
      "evidence": [
        "demo-a-s01-t013",
        "demo-a-s01-t014",
        "demo-a-s01-t015",
        "demo-a-s01-t016"
      ],
      "reviewer_id": null,
      "reviewed_at": null
    },
    {
      "_id": "4",
      "episode_id": "ep-run-llm-demo-a-001-demo-a-s01-005",
      "run_id": "run-llm-demo-a-001",
      "identifiedBy": "AI",
      "layer_id": "episodes",
      "codebook_version": "2.2.0",
      "domain": "math",
      "EPISODE": "monitor",
      "start_turn_id": "demo-a-s01-t017",
      "end_turn_id": "demo-a-s01-t023",
      "evidence": [
        "demo-a-s01-t017",
        "demo-a-s01-t018",
        "demo-a-s01-t019",
        "demo-a-s01-t020",
        "demo-a-s01-t021",
        "demo-a-s01-t022",
        "demo-a-s01-t023"
      ],
      "reviewer_id": null,
      "reviewed_at": null
    },
    {
      "_id": "5",
      "episode_id": "ep-run-llm-demo-a-001-demo-a-s01-006",
      "run_id": "run-llm-demo-a-001",
      "identifiedBy": "AI",
      "layer_id": "episodes",
      "codebook_version": "2.2.0",
      "domain": "math",
      "EPISODE": "planning",
      "start_turn_id": "demo-a-s01-t024",
      "end_turn_id": "demo-a-s01-t032",
      "evidence": [
        "demo-a-s01-t024",
        "demo-a-s01-t025",
        "demo-a-s01-t026",
        "demo-a-s01-t027",
        "demo-a-s01-t028",
        "demo-a-s01-t029",
        "demo-a-s01-t030",
        "demo-a-s01-t031",
        "demo-a-s01-t032"
      ],
      "reviewer_id": null,
      "reviewed_at": null
    },
    {
      "_id": "6",
      "episode_id": "ep-run-llm-demo-a-001-demo-a-s01-007",
      "run_id": "run-llm-demo-a-001",
      "identifiedBy": "AI",
      "layer_id": "episodes",
      "codebook_version": "2.2.0",
      "domain": "math",
      "EPISODE": "implementation",
      "start_turn_id": "demo-a-s01-t033",
      "end_turn_id": "demo-a-s01-t036",
      "evidence": [
        "demo-a-s01-t033",
        "demo-a-s01-t034",
        "demo-a-s01-t035",
        "demo-a-s01-t036"
      ],
      "reviewer_id": null,
      "reviewed_at": null
    },
    {
      "_id": "7",
      "episode_id": "ep-run-llm-demo-a-001-demo-a-s01-008",
      "run_id": "run-llm-demo-a-001",
      "identifiedBy": "AI",
      "layer_id": "episodes",
      "codebook_version": "2.2.0",
      "domain": "math",
      "EPISODE": "organization",
      "start_turn_id": "demo-a-s01-t037",
      "end_turn_id": "demo-a-s01-t039",
      "evidence": [
        "demo-a-s01-t037",
        "demo-a-s01-t038",
        "demo-a-s01-t039"
      ],
      "reviewer_id": null,
      "reviewed_at": null
    },
    {
      "_id": "8",
      "episode_id": "ep-run-llm-demo-a-001-demo-a-s01-009",
      "run_id": "run-llm-demo-a-001",
      "identifiedBy": "AI",
      "layer_id": "episodes",
      "codebook_version": "2.2.0",
      "domain": "math",
      "EPISODE": "implementation",
      "start_turn_id": "demo-a-s01-t040",
      "end_turn_id": "demo-a-s01-t041",
      "evidence": [
        "demo-a-s01-t040",
        "demo-a-s01-t041"
      ],
      "reviewer_id": null,
      "reviewed_at": null
    },
    {
      "_id": "9",
      "episode_id": "ep-run-llm-demo-a-001-demo-a-s01-010",
      "run_id": "run-llm-demo-a-001",
      "identifiedBy": "AI",
      "layer_id": "episodes",
      "codebook_version": "2.2.0",
      "domain": "math",
      "EPISODE": "planning",
      "start_turn_id": "demo-a-s01-t042",
      "end_turn_id": "demo-a-s01-t042",
      "evidence": [
        "demo-a-s01-t042"
      ],
      "reviewer_id": null,
      "reviewed_at": null
    },
    {
      "_id": "10",
      "episode_id": "ep-run-llm-demo-a-001-demo-a-s01-011",
      "run_id": "run-llm-demo-a-001",
      "identifiedBy": "AI",
      "layer_id": "episodes",
      "codebook_version": "2.2.0",
      "domain": "math",
      "EPISODE": "implementation",
      "start_turn_id": "demo-a-s01-t043",
      "end_turn_id": "demo-a-s01-t043",
      "evidence": [
        "demo-a-s01-t043"
      ],
      "reviewer_id": null,
      "reviewed_at": null
    },
    {
      "_id": "11",
      "episode_id": "ep-run-llm-demo-a-001-demo-a-s01-012",
      "run_id": "run-llm-demo-a-001",
      "identifiedBy": "AI",
      "layer_id": "episodes",
      "codebook_version": "2.2.0",
      "domain": "math",
      "EPISODE": "analysis",
      "start_turn_id": "demo-a-s01-t044",
      "end_turn_id": "demo-a-s01-t049",
      "evidence": [
        "demo-a-s01-t044",
        "demo-a-s01-t045",
        "demo-a-s01-t046",
        "demo-a-s01-t047",
        "demo-a-s01-t048",
        "demo-a-s01-t049"
      ],
      "reviewer_id": null,
      "reviewed_at": null
    },
    {
      "_id": "12",
      "episode_id": "ep-run-llm-demo-a-001-demo-a-s01-013",
      "run_id": "run-llm-demo-a-001",
      "identifiedBy": "AI",
      "layer_id": "episodes",
      "codebook_version": "2.2.0",
      "domain": "math",
      "EPISODE": "monitor",
      "start_turn_id": "demo-a-s01-t050",
      "end_turn_id": "demo-a-s01-t052",
      "evidence": [
        "demo-a-s01-t050",
        "demo-a-s01-t051",
        "demo-a-s01-t052"
      ],
      "reviewer_id": null,
      "reviewed_at": null
    },
    {
      "_id": "0",
      "episode_id": "ep-run-llm-demo-a-001-demo-a-s02-001",
      "run_id": "run-llm-demo-a-001",
      "identifiedBy": "AI",
      "layer_id": "episodes",
      "codebook_version": "2.2.0",
      "domain": "math",
      "EPISODE": "reading",
      "start_turn_id": "demo-a-s02-t001",
      "end_turn_id": "demo-a-s02-t003",
      "evidence": [
        "demo-a-s02-t001",
        "demo-a-s02-t002",
        "demo-a-s02-t003"
      ],
      "reviewer_id": null,
      "reviewed_at": null
    },
    {
      "_id": "1",
      "episode_id": "ep-run-llm-demo-a-001-demo-a-s02-002",
      "run_id": "run-llm-demo-a-001",
      "identifiedBy": "AI",
      "layer_id": "episodes",
      "codebook_version": "2.2.0",
      "domain": "math",
      "EPISODE": "planning",
      "start_turn_id": "demo-a-s02-t004",
      "end_turn_id": "demo-a-s02-t008",
      "evidence": [
        "demo-a-s02-t004",
        "demo-a-s02-t005",
        "demo-a-s02-t006",
        "demo-a-s02-t007",
        "demo-a-s02-t008"
      ],
      "reviewer_id": null,
      "reviewed_at": null
    },
    {
      "_id": "2",
      "episode_id": "ep-run-llm-demo-a-001-demo-a-s02-003",
      "run_id": "run-llm-demo-a-001",
      "identifiedBy": "AI",
      "layer_id": "episodes",